<?xml version="1.0" encoding="UTF-8"?>
<!-- ******************************************************************************
 *
 * Pentaho
 *
 * Copyright (C) 2026 by Pentaho Canada Inc. : http://www.pentaho.com
 *
 * Use of this software is governed by the Business Source License included
 * in the LICENSE.TXT file.
 *
 * Change Date: 2030-06-15
 ******************************************************************************* -->
<c:model 
    xmlns:c="urn:webdetails/com/2012" 
    xmlns:xsi="http://www.w3.org/2001/XMLSchema-instance"
    xsi:schemaLocation="urn:webdetails/com/2012 ../../schema/com_2012.xsd"
    xmlns="http://www.w3.org/1999/xhtml">
    
    <c:complexType name="Panel" 
                   space="pvc.options.panels"
                   abstract="true">
        <c:documentation>
            The common options documentation class of the CCC panels.
        </c:documentation>
        
        <c:property name="size" type="number string pvc.options.varia.Size" category="Layout">
            <c:documentation>
                The fixed size of the panel, in pixel units or as a percentage.
                
                See <c:link to="pvc.options.varia.Size" /> for information about 
                the different supported data types.
            </c:documentation>
        </c:property>
        
        <c:property name="sizeMax" type="number string pvc.options.varia.Size" category="Layout">
            <c:documentation>
                The maximum size of the panel, in pixel units or as a percentage.
                
                See <c:link to="pvc.options.varia.Size" /> for information about 
                the different supported data types.
            </c:documentation>
        </c:property>
    </c:complexType>
    
</c:model>