<?xml version="1.0" encoding="UTF-8"?>
<!-- ******************************************************************************
 *
 * Pentaho
 *
 * Copyright (C) 2026 by Pentaho Canada Inc. : http://www.pentaho.com
 *
 * Use of this software is governed by the Business Source License included
 * in the LICENSE.TXT file.
 *
 * Change Date: 2030-06-15
 ******************************************************************************* -->
<c:model 
    xmlns:c="urn:webdetails/com/2012" 
    xmlns:xsi="http://www.w3.org/2001/XMLSchema-instance"
    xsi:schemaLocation="urn:webdetails/com/2012 ../../../schema/com_2012.xsd"
    xmlns="http://www.w3.org/1999/xhtml">
    
    <c:functionType name="DimensionConverter" space="pvc.options.varia">
        <c:documentation>
            A function that converts a non-null raw value
            into a value of the dimension's 
            <c:link to="pvc.options.DimensionType#valueType" />
            or some value that 
            its cast function can convert from.
        </c:documentation>
        <c:argument name="this" type="null" required="true">
            <c:documentation>
                The global JavaScript object.
            </c:documentation>
        </c:argument>
        <c:argument name="sourceValue" type="any" required="true">
            <c:documentation>
                The non-null source value to convert.
                
                In the case where the raw value to convert is 
                a Google-table-like cell, 
                it is the value of its <tt>v</tt>
                property that is passed to this argument.
            </c:documentation>
        </c:argument>
        <c:returns type="any">
            <c:documentation>
                The converted value.
            </c:documentation>
        </c:returns>
    </c:functionType>
</c:model>