<?xml version="1.0" encoding="UTF-8"?>
<!-- ******************************************************************************
 *
 * Pentaho
 *
 * Copyright (C) 2026 by Pentaho Canada Inc. : http://www.pentaho.com
 *
 * Use of this software is governed by the Business Source License included
 * in the LICENSE.TXT file.
 *
 * Change Date: 2030-06-15
 ******************************************************************************* -->
<c:model 
    xmlns:c="urn:webdetails/com/2012" 
    xmlns:xsi="http://www.w3.org/2001/XMLSchema-instance"
    xsi:schemaLocation="urn:webdetails/com/2012 ../../schema/com_2012.xsd"
    xmlns="http://www.w3.org/1999/xhtml">
    
    <c:facetType name="LinesAndDotsPlotFacet" space="pvc.options.plots">
        <c:documentation>
            The options documentation class of the lines and dots plot facet.
        </c:documentation>
        
        <c:property name="dotsVisible" type="boolean" default="false" category="Style">
            <c:documentation>
                Indicates if the visual elements show dots/markers
                in each point's position.
            </c:documentation>
        </c:property>
        
        <c:property name="linesVisible" type="boolean" default="false" category="Style">
            <c:documentation>
                Indicates if the visual elements are connected
                with lines.
            </c:documentation>
        </c:property>
        
        <c:property name="showDots" type="boolean" category="Style">
            <c:documentation>
                <c:deprecated>Use <c:link to="#dotsVisible" /> instead.</c:deprecated>
                Indicates if the visual elements show dots/markers
                in each point's position.
            </c:documentation>
        </c:property>
        
        <c:property name="showLines" type="boolean" category="Style">
            <c:documentation>
                <c:deprecated>Use <c:link to="#linesVisible" /> instead.</c:deprecated>
                Indicates if the visual elements are connected
                with lines.
            </c:documentation>
        </c:property>
    </c:facetType>
    
</c:model>