<?xml version="1.0" encoding="UTF-8"?>
<c:model 
    xmlns:c="urn:webdetails/com/2012" 
    xmlns:xsi="http://www.w3.org/2001/XMLSchema-instance"
    xsi:schemaLocation="urn:webdetails/com/2012 ../../../schema/com_2012.xsd"
    xmlns="http://www.w3.org/1999/xhtml">
    
    <c:atomType name="AxisTicksRegularity" space="pvc.options.varia" base="boolean">
        <c:documentation>
            The ticks regularity is used to guarantee that the ticks keep the 
            same regularity from one rendering to the next.

            This only applies when the domain has some order among its elements
            (some minimum and maximum values), and the scale domain is exactly 
            the domain of the data.

            For more information, see the following option:
            <c:link to="pvc.options.varia.AxisDomainRoundingMode#None" />
        </c:documentation>
        
        <c:atom name="True" value="'true'">
            <c:documentation>
                The ticks regularity will be kept by preserving last minium
                value in order to calculate the next tick starting date.
            </c:documentation>
        </c:atom>
        
        <c:atom name="False" value="'false'">
            <c:documentation>
                The ticks will be rendered following the domain of the data and
                not taking in account previous tick values.
            </c:documentation>
        </c:atom>
        
    </c:atomType>
</c:model>
