<?xml version="1.0" encoding="UTF-8"?>
<!-- ******************************************************************************
 *
 * Pentaho
 *
 * Copyright (C) 2026 by Pentaho Canada Inc. : http://www.pentaho.com
 *
 * Use of this software is governed by the Business Source License included
 * in the LICENSE.TXT file.
 *
 * Change Date: 2030-06-15
 ******************************************************************************* -->
<c:model 
    xmlns:c="urn:webdetails/com/2012" 
    xmlns:xsi="http://www.w3.org/2001/XMLSchema-instance"
    xsi:schemaLocation="urn:webdetails/com/2012 ../../schema/com_2012.xsd"
    xmlns="http://www.w3.org/1999/xhtml">
    
    <c:complexType name="RuleExtensionPoint" 
                   space="pvc.options.marks" 
                   base="pvc.options.marks.MarkExtensionPoint"
                   facets="pvc.options.marks.StrokeBasicFacet">
         <c:documentation>
            The class of protovis Rule extension points.
            
            See the associated protovis documentation at
            <c:link to="http://mbostock.github.com/protovis/jsdoc/symbols/pv.Rule.html" />.
        </c:documentation>
        
        <c:property name="width" type="number">
            <c:documentation>
                The width of the rule, when it is horizontal.
            </c:documentation>
        </c:property>
        
        <c:property name="height" type="number">
            <c:documentation>
                The height of the rule, when it is vertical.
            </c:documentation>
        </c:property>
        
    </c:complexType>
    
</c:model>